{
  "schema_version": "g14a.v1",
  "tool": "tools/uni_cluster_review_progress_g14_a.py",
  "input": {
    "path": "docs/coordination/UNI_CLUSTER_REVIEW_PACKET_G13_A.json",
    "schema_version": "g13a.v1",
    "cluster_count": 85,
    "batch_count": 9,
    "packet_sha256": "a50a332cff7ca091ddef9fa208da1a66cf4c2938f6ff00926bea25cb70477849"
  },
  "scope": {
    "tracking_level": "g13_cluster",
    "initial_status": "open",
    "human_review_required": true,
    "answers_read": false,
    "didactic_content_copied": false,
    "didactic_content_modified": false,
    "automatic_card_modification": false,
    "automatic_exam_modification": false,
    "source_of_truth": "G13 cluster review packet metadata"
  },
  "workflow": {
    "allowed_statuses": [
      "open",
      "in_review",
      "decided"
    ],
    "evidence_ref_required_for_decided": true,
    "reviewer_required_for_in_review_or_decided": true,
    "rationale_required_for_in_review_or_decided": true,
    "decided_is_not_an_action": true
  },
  "coverage": {
    "cluster_count": 85,
    "batch_count": 9,
    "status_counts": {
      "open": 85,
      "in_review": 0,
      "decided": 0
    },
    "open_count": 85,
    "in_review_count": 0,
    "decided_count": 0,
    "pending_count": 85,
    "all_evidence_refs_null": true,
    "all_reviewers_null": true,
    "all_rationales_null": true
  },
  "batches": [
    {
      "batch_id": "batch-01",
      "priority_rank_start": 1,
      "priority_rank_end": 10,
      "cluster_count": 10,
      "cluster_ids": [
        "component-0036",
        "component-0025",
        "component-0033",
        "component-0001",
        "component-0002",
        "component-0004",
        "component-0007",
        "component-0011",
        "component-0012",
        "component-0022"
      ],
      "status_counts": {
        "open": 10,
        "in_review": 0,
        "decided": 0
      },
      "decided_count": 0
    },
    {
      "batch_id": "batch-02",
      "priority_rank_start": 11,
      "priority_rank_end": 20,
      "cluster_count": 10,
      "cluster_ids": [
        "component-0071",
        "component-0072",
        "component-0073",
        "component-0074",
        "component-0075",
        "component-0076",
        "component-0079",
        "component-0080",
        "component-0083",
        "component-0084"
      ],
      "status_counts": {
        "open": 10,
        "in_review": 0,
        "decided": 0
      },
      "decided_count": 0
    },
    {
      "batch_id": "batch-03",
      "priority_rank_start": 21,
      "priority_rank_end": 30,
      "cluster_count": 10,
      "cluster_ids": [
        "component-0081",
        "component-0082",
        "component-0003",
        "component-0005",
        "component-0009",
        "component-0010",
        "component-0024",
        "component-0028",
        "component-0032",
        "component-0035"
      ],
      "status_counts": {
        "open": 10,
        "in_review": 0,
        "decided": 0
      },
      "decided_count": 0
    },
    {
      "batch_id": "batch-04",
      "priority_rank_start": 31,
      "priority_rank_end": 40,
      "cluster_count": 10,
      "cluster_ids": [
        "component-0037",
        "component-0038",
        "component-0039",
        "component-0043",
        "component-0048",
        "component-0051",
        "component-0052",
        "component-0050",
        "component-0006",
        "component-0008"
      ],
      "status_counts": {
        "open": 10,
        "in_review": 0,
        "decided": 0
      },
      "decided_count": 0
    },
    {
      "batch_id": "batch-05",
      "priority_rank_start": 41,
      "priority_rank_end": 50,
      "cluster_count": 10,
      "cluster_ids": [
        "component-0013",
        "component-0014",
        "component-0015",
        "component-0016",
        "component-0017",
        "component-0018",
        "component-0019",
        "component-0020",
        "component-0021",
        "component-0023"
      ],
      "status_counts": {
        "open": 10,
        "in_review": 0,
        "decided": 0
      },
      "decided_count": 0
    },
    {
      "batch_id": "batch-06",
      "priority_rank_start": 51,
      "priority_rank_end": 60,
      "cluster_count": 10,
      "cluster_ids": [
        "component-0026",
        "component-0027",
        "component-0029",
        "component-0030",
        "component-0031",
        "component-0034",
        "component-0040",
        "component-0041",
        "component-0042",
        "component-0044"
      ],
      "status_counts": {
        "open": 10,
        "in_review": 0,
        "decided": 0
      },
      "decided_count": 0
    },
    {
      "batch_id": "batch-07",
      "priority_rank_start": 61,
      "priority_rank_end": 70,
      "cluster_count": 10,
      "cluster_ids": [
        "component-0045",
        "component-0046",
        "component-0047",
        "component-0049",
        "component-0053",
        "component-0054",
        "component-0055",
        "component-0056",
        "component-0057",
        "component-0058"
      ],
      "status_counts": {
        "open": 10,
        "in_review": 0,
        "decided": 0
      },
      "decided_count": 0
    },
    {
      "batch_id": "batch-08",
      "priority_rank_start": 71,
      "priority_rank_end": 80,
      "cluster_count": 10,
      "cluster_ids": [
        "component-0059",
        "component-0060",
        "component-0061",
        "component-0062",
        "component-0063",
        "component-0064",
        "component-0065",
        "component-0066",
        "component-0067",
        "component-0068"
      ],
      "status_counts": {
        "open": 10,
        "in_review": 0,
        "decided": 0
      },
      "decided_count": 0
    },
    {
      "batch_id": "batch-09",
      "priority_rank_start": 81,
      "priority_rank_end": 85,
      "cluster_count": 5,
      "cluster_ids": [
        "component-0069",
        "component-0070",
        "component-0077",
        "component-0078",
        "component-0085"
      ],
      "status_counts": {
        "open": 5,
        "in_review": 0,
        "decided": 0
      },
      "decided_count": 0
    }
  ],
  "clusters": [
    {
      "cluster_id": "component-0036",
      "priority_rank": 1,
      "batch": {
        "batch_id": "batch-01",
        "batch_rank": 1
      },
      "status": "open",
      "evidence_ref": null,
      "reviewer": null,
      "rationale": null
    },
    {
      "cluster_id": "component-0025",
      "priority_rank": 2,
      "batch": {
        "batch_id": "batch-01",
        "batch_rank": 2
      },
      "status": "open",
      "evidence_ref": null,
      "reviewer": null,
      "rationale": null
    },
    {
      "cluster_id": "component-0033",
      "priority_rank": 3,
      "batch": {
        "batch_id": "batch-01",
        "batch_rank": 3
      },
      "status": "open",
      "evidence_ref": null,
      "reviewer": null,
      "rationale": null
    },
    {
      "cluster_id": "component-0001",
      "priority_rank": 4,
      "batch": {
        "batch_id": "batch-01",
        "batch_rank": 4
      },
      "status": "open",
      "evidence_ref": null,
      "reviewer": null,
      "rationale": null
    },
    {
      "cluster_id": "component-0002",
      "priority_rank": 5,
      "batch": {
        "batch_id": "batch-01",
        "batch_rank": 5
      },
      "status": "open",
      "evidence_ref": null,
      "reviewer": null,
      "rationale": null
    },
    {
      "cluster_id": "component-0004",
      "priority_rank": 6,
      "batch": {
        "batch_id": "batch-01",
        "batch_rank": 6
      },
      "status": "open",
      "evidence_ref": null,
      "reviewer": null,
      "rationale": null
    },
    {
      "cluster_id": "component-0007",
      "priority_rank": 7,
      "batch": {
        "batch_id": "batch-01",
        "batch_rank": 7
      },
      "status": "open",
      "evidence_ref": null,
      "reviewer": null,
      "rationale": null
    },
    {
      "cluster_id": "component-0011",
      "priority_rank": 8,
      "batch": {
        "batch_id": "batch-01",
        "batch_rank": 8
      },
      "status": "open",
      "evidence_ref": null,
      "reviewer": null,
      "rationale": null
    },
    {
      "cluster_id": "component-0012",
      "priority_rank": 9,
      "batch": {
        "batch_id": "batch-01",
        "batch_rank": 9
      },
      "status": "open",
      "evidence_ref": null,
      "reviewer": null,
      "rationale": null
    },
    {
      "cluster_id": "component-0022",
      "priority_rank": 10,
      "batch": {
        "batch_id": "batch-01",
        "batch_rank": 10
      },
      "status": "open",
      "evidence_ref": null,
      "reviewer": null,
      "rationale": null
    },
    {
      "cluster_id": "component-0071",
      "priority_rank": 11,
      "batch": {
        "batch_id": "batch-02",
        "batch_rank": 1
      },
      "status": "open",
      "evidence_ref": null,
      "reviewer": null,
      "rationale": null
    },
    {
      "cluster_id": "component-0072",
      "priority_rank": 12,
      "batch": {
        "batch_id": "batch-02",
        "batch_rank": 2
      },
      "status": "open",
      "evidence_ref": null,
      "reviewer": null,
      "rationale": null
    },
    {
      "cluster_id": "component-0073",
      "priority_rank": 13,
      "batch": {
        "batch_id": "batch-02",
        "batch_rank": 3
      },
      "status": "open",
      "evidence_ref": null,
      "reviewer": null,
      "rationale": null
    },
    {
      "cluster_id": "component-0074",
      "priority_rank": 14,
      "batch": {
        "batch_id": "batch-02",
        "batch_rank": 4
      },
      "status": "open",
      "evidence_ref": null,
      "reviewer": null,
      "rationale": null
    },
    {
      "cluster_id": "component-0075",
      "priority_rank": 15,
      "batch": {
        "batch_id": "batch-02",
        "batch_rank": 5
      },